{
  "id": "188329",
  "title": "DE Update 188329",
  "branch": "DE",
  "releaseType": "release",
  "releaseDate": "2026-10-27",
  "announcedAt": "2026-10-27",
  "publishedAt": "2026-10-28",
  "sourcePublishedAt": "2026-10-27T10:04:41-07:00",
  "source": "https://www.ageofempires.com/news/age-of-empires-ii-definitive-edition-update-188329/",
  "verifiedAt": "2026-10-29",
  "coverage": "已核对三组平衡改动：骑象射手、掷石绳骑兵与蔷琵斥候；未收录完整官方修复清单。",
  "note": "改动前取自官方 188329 平衡说明，改动后由本补丁固定 DAT 与生成数据交叉核对。精锐掷石绳骑兵与蔷琵步兵作为不变对照；不声称模拟本次官方引擎修复。",
  "entries": [
    {
      "id": "188329-1",
      "kind": "nerf",
      "targetType": "unit",
      "targetId": 873,
      "targetNameZh": "骑象射手",
      "civIds": [],
      "summaryZh": "基础食物费用增加，黄金费用不变。",
      "before": "60 食物、80 黄金",
      "after": "70 食物、80 黄金",
      "source": "https://www.ageofempires.com/news/age-of-empires-ii-definitive-edition-update-188329/",
      "provenance": "dat",
      "changeType": "stats",
      "verification": "official"
    },
    {
      "id": "188329-2",
      "kind": "nerf",
      "targetType": "unit",
      "targetId": 873,
      "targetNameZh": "骑象射手",
      "civIds": [],
      "summaryZh": "基础生命降低（未计文明与科技加成）。",
      "before": "230",
      "after": "220",
      "source": "https://www.ageofempires.com/news/age-of-empires-ii-definitive-edition-update-188329/",
      "provenance": "dat",
      "changeType": "stats",
      "verification": "official"
    },
    {
      "id": "188329-3",
      "kind": "nerf",
      "targetType": "unit",
      "targetId": 875,
      "targetNameZh": "精锐骑象射手",
      "civIds": [],
      "summaryZh": "基础食物费用增加，黄金费用不变。",
      "before": "60 食物、80 黄金",
      "after": "70 食物、80 黄金",
      "source": "https://www.ageofempires.com/news/age-of-empires-ii-definitive-edition-update-188329/",
      "provenance": "dat",
      "changeType": "stats",
      "verification": "official"
    },
    {
      "id": "188329-4",
      "kind": "nerf",
      "targetType": "unit",
      "targetId": 875,
      "targetNameZh": "精锐骑象射手",
      "civIds": [],
      "summaryZh": "基础生命降低（未计文明与科技加成）。",
      "before": "280",
      "after": "270",
      "source": "https://www.ageofempires.com/news/age-of-empires-ii-definitive-edition-update-188329/",
      "provenance": "dat",
      "changeType": "stats",
      "verification": "official"
    },
    {
      "id": "188329-5",
      "kind": "nerf",
      "targetType": "unit",
      "targetId": 2569,
      "targetNameZh": "掷石绳骑兵",
      "civIds": [
        "Mapuche"
      ],
      "summaryZh": "基础移速降低；精锐移速仍为 1.5。",
      "before": "1.5",
      "after": "1.45",
      "source": "https://www.ageofempires.com/news/age-of-empires-ii-definitive-edition-update-188329/",
      "provenance": "dat",
      "changeType": "stats",
      "verification": "official"
    },
    {
      "id": "188329-6",
      "kind": "buff",
      "targetType": "unit",
      "targetId": 2550,
      "targetNameZh": "蔷琵斥候",
      "civIds": [],
      "summaryZh": "对骑兵类别的额外伤害增加（DAT 类别 8）；蔷琵步兵不变。",
      "before": "1",
      "after": "2",
      "source": "https://www.ageofempires.com/news/age-of-empires-ii-definitive-edition-update-188329/",
      "provenance": "dat",
      "changeType": "stats",
      "verification": "official",
      "originalText": "Scout Cavalry-line and Camel Scout",
      "scopeNote": "官方说明列出的目标是斥候骑兵线与骆驼斥候；此处展示固定 DAT 的骑兵／骆驼攻击类别。对具体单位的净额外伤害还取决于该单位对应类别的护甲，不能仅凭类别名推断。"
    },
    {
      "id": "188329-7",
      "kind": "buff",
      "targetType": "unit",
      "targetId": 2550,
      "targetNameZh": "蔷琵斥候",
      "civIds": [],
      "summaryZh": "对骆驼类别的额外伤害增加（DAT 类别 30）；蔷琵步兵不变。",
      "before": "1",
      "after": "2",
      "source": "https://www.ageofempires.com/news/age-of-empires-ii-definitive-edition-update-188329/",
      "provenance": "dat",
      "changeType": "stats",
      "verification": "official",
      "originalText": "Scout Cavalry-line and Camel Scout",
      "scopeNote": "官方说明列出的目标是斥候骑兵线与骆驼斥候；此处展示固定 DAT 的骑兵／骆驼攻击类别。对具体单位的净额外伤害还取决于该单位对应类别的护甲，不能仅凭类别名推断。"
    }
  ]
}
